{
  "contract": "agent-test-result-v1",
  "subject": "Paperclip fork Actions hardening from e633964d794ac539d2f89028c11d3cb0226b5ade",
  "checks": [
    {"id":"workflow-static-policy","executed":true,"classification":"passed","reason":"Workflow guards and local PR caller inspected with targeted assertions.","risk":"A YAML or expression error could re-enable a release path.","ciTreatment":"Required CI gate.","command":"node --test .github/scripts/tests/fork-actions-hardening.test.mjs"},
    {"id":"workflow-yaml-parse","executed":true,"classification":"passed","reason":"Ruby Psych parsed all nine workflows changed by PR #8.","risk":"GitHub expression semantics are not fully modeled by a generic YAML parser.","ciTreatment":"Required CI gate plus GitHub workflow validation.","command":"ruby -e 'require \"yaml\"; ARGV.each { |f| YAML.load_file(f) }' <changed-workflows>"},
    {"id":"commitperclip-neutral-fork","executed":true,"classification":"passed","reason":"Fork path contains no COMMITPERCLIP_KEY reference and records neutral status.","risk":"A future edit could expose the secret to fork context.","ciTreatment":"Required CI gate.","command":"node --test .github/scripts/tests/commitperclip-review-workflow.test.mjs"},
    {"id":"dependency-review-upstream","executed":true,"classification":"passed","reason":"Dependency Review remains scoped to the canonical upstream repository.","risk":"Fork dependency graph availability is not proved by this static check.","ciTreatment":"Run upstream-only; neutral on fork.","command":"node --test .github/scripts/tests/commitperclip-review-workflow.test.mjs"},
    {"id":"action-sha-pinning","executed":true,"classification":"passed","reason":"Targeted test scans every workflow changed by PR #8, not only publication workflows.","risk":"Unchanged inherited workflows may still contain mutable tags and require later inventory.","ciTreatment":"Required for changed workflows; report residual inventory.","command":"node --test .github/scripts/tests/fork-actions-hardening.test.mjs"},
    {"id":"pnpm-test","executed":false,"classification":"unavailable","reason":"Full dependency-backed test suite was not run during workflow-only hardening.","risk":"Application regressions outside workflow contracts are not covered locally.","ciTreatment":"Run in CI before merge.","command":"pnpm test"},
    {"id":"pnpm-typecheck-build","executed":false,"classification":"unavailable","reason":"Typecheck and build are unrelated to the workflow-only diff and were not run.","risk":"Packaging regressions are not covered locally.","ciTreatment":"Run standard PR CI before merge.","command":"pnpm -r typecheck && pnpm build"},
    {"id":"prettier","executed":false,"classification":"unavailable","reason":"The local checkout has no Prettier executable available through pnpm.","risk":"Formatting drift may be detected by CI.","ciTreatment":"Run the repository formatting gate in CI before merge.","command":"pnpm exec prettier --check <changed-files>"},
    {"id":"actions-live-run","executed":false,"classification":"unavailable","reason":"Actions were not enabled or administratively triggered.","risk":"Live GitHub event behavior remains unproved locally.","ciTreatment":"Required after branch push by repository CI; no manual activation in this task.","command":"GitHub Actions"},
    {"id":"release-publication","executed":false,"classification":"not-applicable","reason":"This task must not publish npm, Docker, GHCR, or cloud artifacts.","risk":"Publication behavior is intentionally untested.","ciTreatment":"Never run on the fork; upstream release qualification owns it.","command":"n/a"}
  ],
  "transmission": {"status":"complete","records":10}
}
